Company,Initiative,Focus Area,Key Features,Impact
Geotab,EV Suitability Assessment,Fleet electrification,Identify EV candidates financial forecasts model selection,Simplifying fleet electrification
Geotab,Sustainability Solutions,EV support,~300 EV models supported comprehensive EV data,Industry-leading EV fleet management
Geotab,Altitude ITS,Infrastructure planning,EV charging infrastructure corridor planning,Grid operator preparedness for electrification
MICHELIN,Sustainable Mobility,20+ years innovation,Make mobility safer more efficient more environmentally friendly,Core company mission
MICHELIN Connected Fleet,Sustainability Focus,Run sustainable fleets,Tools and information for sustainability,Fleet operator enablement
Geotab,Green Fleet Solutions,Fuel efficiency,Fuel consumption tracking efficiency reporting,Reduce emissions and costs
Fleet Complete,Fuel Management,Fuel tracking,Fuel consumption monitoring fuel card integration,Cost reduction environmental impact
Gurtam,Smart Reports,KPI Management,Comprehensive fleet and driver view for business results,Prevent accidents increase productivity
