Trend Category,Trend Description,Evidence,Timeline,Market Impact,Companies Affected
Network Migration,3G to 4G/5G transition,Multiple vendors migrating customers from 3G,2020-2022,Forced hardware upgrades creating replacement cycle,ORBCOMM Prime Inc Marten Transport SkyBitz
OEM Standardization,Factory-installed telematics becoming standard,Great Dane first to make standard on all new trailers,Aug 2021,Shifts aftermarket to retrofit and mixed fleet,Great Dane Hyundai Translead
Free Service Models,OEMs eliminating subscription fees,Komatsu Hitachi John Deere announce no renewals,Jul 2021,Pressure on aftermarket pricing and differentiation,Heavy equipment OEMs vs aftermarket
Smart Trailer Adoption,Integrated IoT sensors and connectivity,Tens of thousands deployed Road Ready leading,2019-2021,New capabilities beyond GPS tracking,Truck-Lite Phillips Great Dane Peterson PowerFleet
Consolidation,M&A activity continues,GI Partners acquires ORBCOMM / EROAD acquires Coretex,2021,Market concentration fewer independent players,ORBCOMM Coretex
Cold Chain Focus,Food safety regulations driving adoption,FSMA compliance temperature monitoring critical,Ongoing,Premium pricing for reefer solutions,ORBCOMM Coretex Thermo King Carrier
AI and Machine Learning,Advanced analytics cargo sensing,IntelliScan 99% accuracy / Image recognition,2018-2020,Differentiation beyond basic GPS,Spireon ORBCOMM Coretex
Modular Architecture,Flexible sensor ecosystems,FL Flex / Smart Trailer platforms / BLE sensors,2017-2021,Customer choice and future-proofing,Spireon Great Dane ORBCOMM
Dual-Mode Connectivity,Cellular plus satellite backup,Remote area coverage and reliability,2020,Addresses coverage gaps,ORBCOMM
Managed Services,Data analytics and benchmarking,Spireon aggregate fleet benchmarking,Jul 2021,Value-added services beyond raw data,Spireon
Mixed Fleet Management,Single platform for multiple brands,AEMP 2.0 standard adoption,2019,Customers want unified view,Industry-wide
Rail and Intermodal,Growth in container and chassis tracking,BlackBerry Radar rail focus / ORBCOMM intermodal,2019-2021,Expansion beyond OTR trailers,BlackBerry Radar ORBCOMM
LTL Market,Large LTL deployments,Estes 40K units / Old Dominion,2021,LTL segment significant opportunity,Spireon Coretex
Private Equity Interest,Financial investors see opportunity,GI Partners $1.1B ORBCOMM / Avista Telular,2013-2021,Validates market growth and returns,ORBCOMM SkyBitz
Vertical Integration,OEMs bundle with core products,Thermo King Carrier include with reefer units,2017-2021,Competitive advantage for OEMs,Thermo King Carrier vs pure-play telematics
Technology Partnerships,Complementary solution bundling,SkyBitz-Coretex for complete tracking,2020,Better together than standalone,Multiple partnerships
Direct vs Channel,Distribution strategy evolution,BlackBerry adds multiple distributors May 2020,2020,Geographic and segment expansion,BlackBerry Radar
International Expansion,US vendors entering Mexico/LatAm,BlackBerry Radar Mexican distributors / KORE,2020,Market growth beyond North America,BlackBerry Radar ORBCOMM
Theft Prevention,Equipment and cargo security focus,$300M-$1B annual theft,Ongoing,Security features increasingly important,All vendors
Sustainability Reporting,Environmental compliance tracking,Fuel consumption idle time CO2,Ongoing,ESG requirements driving adoption,Caterpillar Volvo
Remote Diagnostics,Proactive maintenance and uptime,Dealer remote troubleshoot and flash,2020-2021,Reduce downtime and service costs,Caterpillar Hitachi
Construction Recovery,Equipment demand increasing post-COVID,Recovery began second half 2020,2020-2021,Positive for OEM telematics growth,All construction OEMs
