Rank,Department,City_State,Total_Vehicles,Motorcycles,AVL_Status,Notes
1,New York City Police Department (NYPD),New York NY,9000,115,All active patrol cars equipped with AVL,1790 marked + 899 unmarked new cars in 2018-19
2,Los Angeles Police Department,Los Angeles CA,4700,,,Over 4700 vehicles
3,Chicago Police Department,Chicago IL,3854,,,
4,Massachusetts State Police,Massachusetts,3180,,Fully equipped with AVL,All 3180 cruisers
5,Dallas Police Department,Dallas TX,,,Nearly all patrol cars have GPS/AVL,