Association_Name,Location,Website,Market_Segment,Services
American Trucking Association,N/A,N/A,Trucking Industry General,Industry statistics and advocacy
Truckload Carriers Association,N/A,www.truckload.org,Truckload,Industry association
National Private Truck Council,Alexandria VA,N/A,Private Fleets,Trade association quarterly newsletter
National Conference of State Fleet Administrators,N/A,www.ncsfa.net,State Government Fleets,Quarterly newsletter
American Association of State Highway and Transportation Officials,N/A,www.transportation.org,State DOT,Professional association
