Solution_Type,Units_in_Service,Market_Segment,Details,Source_Page
GPS Fleet Management,125000,Government Agencies,"Federal Bureau of Prisons Bureau of Veterans Affairs U.S. Postal Service",117
GPS Fleet Management,125000,Technology,Cellular-based and dual-mode cellular/satellite,117
GPS Fleet Management,114000,Transportation and Oil & Gas,"Tractor-trailers (in-cab) mid-size and light trucks",117
GPS Fleet Management,114000,Source,Legacy subscribers from inthinc and Blue Tree Systems acquisitions,117
Refrigerated Trailer Monitoring,Largest U.S. supplier,Cold Chain,Telematics solutions for refrigerated trailers,117
Asset Tracking,Not specified,Heavy Equipment,"Trailers containers commodities logistics tracking",118
Next Generation Tag,Up to 45600000 USD contract,U.S. Army,"NGT program cellular satellite dual-mode devices",118
NGT Contract Duration,Through December 9 2024,U.S. Government,Indefinite Delivery Indefinite Quantity contract,118
