Company,Product_Name,Launch_Year,Features,Integration,Notes
Zonar Systems,Zonar MyView,2020,Parent app for school bus tracking location,Route-agnostic,Dispatcher portal for communications
Zonar Systems,MyView Ridership Alerts,2021,Board and exit notifications,Z Pass ridership hardware,Shows when and where child boards/exits
Zonar Systems,Zonar OnRoute,2021,Turn-by-turn directions,Route agnostic,Driver navigation
Zonar Systems,Zonar Access,2021,Driver task and time management,Bytecurve 360 technology,Partnership announced 2021
Zonar Systems,BusPatrol Partnership,2020,Stop-arm enforcement cameras,Exclusive partnership,No cost to schools - violator fines cover costs
Zonar Systems,Electric School Bus Support,2021,Pupil product solutions,Supported on electric buses,