Company,Global Scale,Americas Presence,Key Differentiator,Technology Approach,Target Market
Fleet Complete,606K subscribers,401K Americas units,OEM partnerships with GM Ford Toyota Stellantis,Hardware + SaaS,SMB to Enterprise
Geotab,4.5M+ subscriptions,3.7M Americas units,Open platform with 300+ marketplace solutions,Hardware-agnostic platform,Enterprise focus (60% fleets 500+ vehicles)
Gurtam,4M+ Wialon units,735K Americas Wialon units,Software platform sold through 2700+ service providers,Pure software platform,Service provider channel
KORE Position Logic,160K assets,75% in Latin America,IoT platform with fleet management,Hardware-agnostic SaaS,75% Latin America focus
MICHELIN Connected Fleet,687K vehicles,400K+ Americas units,Tire company backing with sustainability focus,Regional platforms consolidating,SMB to Enterprise
MiX by Powerfleet,Global presence,Strong global footprint,Legacy Siemens VDO heritage,SaaS Connected & Protected,Enterprise fleets
