Category,Insight,Details
Market,Sector Description,Video and Driver Behavior Management Solutions,
Market,Growth Status,Growing sector,Many new suppliers
Technology,Key Technologies,"Video, artificial intelligence, machine learning, vehicle sensors",
Applications,Monitoring Capabilities,"Speeding, hard braking, fast acceleration, speed on turns",
Applications,Driver Scoring,Scorecards rating driver performance,
Applications,Video Capture,Cameras in vehicles,Some solutions use smartphones
Applications,Real-time Feedback,Alerts for drowsy/inattentive drivers,
Applications,Driver Coaching,Coaching for risky behavior,
Motivation,Primary Use Case 1,Determining liability in accidents,
Motivation,Primary Use Case 2,Coaching drivers with risky behavior,