Company,Product Name,Technology,Connectivity,Year Launched,Key Features
Fleet Complete,Fleet Complete Vision,AI-powered windshield camera,4G LTE,2018,ADAS alerts driver scorecards event detection trip reports
Fleet Complete,Fleet Complete Vision,Integrated platform,4G LTE,2018,Add-on to regular vehicle tracking
MICHELIN,HD Vehicle Incident Camera,High-definition camera,4G LTE,N/A,Downloadable videos real-time alerts live GPS positioning
MICHELIN,Smart Cameras,AI on-board intelligence,Connected,Latin America,Accident prevention inappropriate behavior detection
KORE,Video Capabilities,Basic to AI cameras,Connected,2024,Partnership with Forward Thinking Systems LightMetrics SmartWitness
KORE VISTA,AI Video Technology,Next-generation AI,Connected,2022,Integrated with driver scoring and coaching
Geotab,Marketplace Video Partners,Third-party integration,Via IOX,Ongoing,Multiple camera providers on Marketplace
