Company,Solution Name,EV Models Supported,Key Features,Launch Year,Unique Capabilities
Geotab,EV Support,~300 hybrid and electric models,Comprehensive EV data support,Ongoing,Industry-leading EV support
Geotab,EV Suitability Assessment (EVSA),~300 models,Tailored roadmap for fleet electrification,2020,Real-world data analysis financial forecasts model selection
Geotab,FleetCarma Acquisition,N/A,EV telematics specialization,2018,Positioned as major EV fleet management player
Geotab,EV Data Signals,~300 models,Battery state-of-charge health range energy signals charging power,Ongoing,Comprehensive real-time data
Fleet Complete,OEM EV Support,Select OEM EVs,Advanced support for OEM connected EVs,Apr 2024,Direct OEM EV data integration North America
Fleet Complete,Unified Platform,GM Ford Stellantis EVs,All-in-one platform integrating OEM EV and ICE vehicle insights,Apr 2024,Integrated fleet insights
MICHELIN,EV Fleet Solutions,Various,EV-specific fleet management,Ongoing,Part of sustainability focus
