Product,Provider,Pricing,Target Market,Features
AT&T Fleet Complete Fleet Tracker,Fleet Complete (Toronto),14.99/month (3-year contract),Field service; delivery; construction,GPS fleet management; dispatch; signature capture; barcode scanning
AT&T Fleet Complete Asset Tracker,Fleet Complete (Toronto),10.00/month,Asset tracking,GPS-based asset tracking
AT&T Fleet Management for Enterprise,Geotab,N/A,Enterprise fleets,Comprehensive fleet management integrated with AT&T IoT platforms
AT&T Fleet Management for Government,Geotab,N/A,Government fleets,Comprehensive fleet management integrated with AT&T IoT platforms
AT&T Fleet Complete Video,Fleet Complete,N/A,All fleet segments,Dual-facing camera solution
AT&T Asset Management - Shipping Containers,AT&T,N/A,Logistics,End-to-end cloud-based asset monitoring
AT&T Asset Management - Operations Center,AT&T,N/A,Multiple industries,Cloud-based IoT application; plug-and-play device configuration; dashboard; APIs
